{
  "$schema": "../../../contracts/provider-wire-fixture.schema.json",
  "schemaVersion": "provider-wire-fixture/v1",
  "id": "bailian.omni.realtime.ws.fixture.v1",
  "providerId": "bailian",
  "protocolProfileId": "bailian.omni.realtime.ws",
  "protocolProfileVersion": 1,
  "kind": "wire",
  "provenance": {
    "sourceDocumentationIds": [
      "bailian.docs.4",
      "bailian.docs.5"
    ],
    "capturedFromLive": false,
    "sanitized": true,
    "notes": "Generated documentation fixture projection from apps/desktop/src-tauri/fixtures/model-protocol/omni-session.json; never authorizes paid calls."
  },
  "scenario": "Exact bailian.omni.realtime.ws protocol replay",
  "data": {
    "endpointStatus": "verified",
    "networkAuthorized": false,
    "connectionUrl": "wss://dashscope.aliyuncs.com/api-ws/v1/realtime?model=qwen3.5-omni-plus-realtime",
    "authContract": {
      "profileId": "bailian.auth.bearer",
      "parameters": [
        {
          "location": "header",
          "name": "Authorization",
          "value": "Bearer <redacted>"
        }
      ]
    },
    "audioContract": {
      "input": {
        "required": false,
        "codecs": [
          "pcm16"
        ],
        "sampleRatesHz": [
          16000
        ],
        "channels": [
          1
        ]
      },
      "output": {
        "required": false,
        "codecs": [
          "pcm16"
        ],
        "sampleRatesHz": [
          24000
        ],
        "channels": [
          1
        ]
      }
    },
    "events": [
      {
        "direction": "server",
        "frameKind": "json",
        "eventType": "session.created",
        "type": "session.created"
      },
      {
        "direction": "client",
        "frameKind": "json",
        "eventType": "session.update",
        "type": "session.update"
      },
      {
        "direction": "server",
        "frameKind": "json",
        "eventType": "session.updated",
        "type": "session.updated"
      },
      {
        "direction": "client",
        "frameKind": "json-base64",
        "eventType": "input_audio_buffer.append",
        "type": "input_audio_buffer.append",
        "audio": "<redacted>"
      },
      {
        "direction": "client",
        "frameKind": "json",
        "eventType": "input_audio_buffer.commit",
        "type": "input_audio_buffer.commit"
      },
      {
        "direction": "client",
        "frameKind": "json",
        "eventType": "response.create",
        "type": "response.create"
      },
      {
        "direction": "server",
        "frameKind": "json",
        "eventType": "response.text.delta",
        "payload": {
          "delta": "hello"
        },
        "type": "response.text.delta"
      },
      {
        "direction": "server",
        "frameKind": "json",
        "eventType": "response.text.done",
        "type": "response.text.done"
      },
      {
        "direction": "server",
        "frameKind": "json",
        "eventType": "response.done",
        "type": "response.done",
        "terminal": true
      }
    ]
  }
}
