{
  "$schema": "../../../contracts/provider-wire-fixture.schema.json",
  "schemaVersion": "provider-wire-fixture/v1",
  "id": "bailian.task-tts.cosyvoice-v3.ws.fixture.v1",
  "providerId": "bailian",
  "protocolProfileId": "bailian.task-tts.cosyvoice-v3.ws",
  "protocolProfileVersion": 1,
  "kind": "wire",
  "provenance": {
    "sourceDocumentationIds": [
      "bailian.docs.25",
      "bailian.docs.27"
    ],
    "capturedFromLive": false,
    "sanitized": true,
    "notes": "Generated documentation fixture projection from apps/desktop/src-tauri/fixtures/model-protocol/task-tts-duplex.json; never authorizes paid calls."
  },
  "scenario": "Exact bailian.task-tts.cosyvoice-v3.ws protocol replay",
  "data": {
    "endpointStatus": "verified",
    "networkAuthorized": false,
    "connectionUrl": "wss://dashscope.aliyuncs.com/api-ws/v1/inference",
    "authContract": {
      "profileId": "bailian.auth.bearer",
      "parameters": [
        {
          "location": "header",
          "name": "Authorization",
          "value": "Bearer <redacted>"
        }
      ]
    },
    "audioContract": {
      "input": {
        "required": false,
        "codecs": [],
        "sampleRatesHz": [],
        "channels": []
      },
      "output": {
        "required": true,
        "codecs": [
          "pcm16",
          "wav",
          "mp3",
          "opus"
        ],
        "sampleRatesHz": [
          8000,
          16000,
          22050,
          24000,
          44100,
          48000
        ],
        "channels": [
          1
        ]
      }
    },
    "events": [
      {
        "direction": "client",
        "frameKind": "json",
        "eventType": "run-task",
        "wire": {
          "header": {
            "action": "run-task",
            "task_id": "77777777-7777-4777-8777-777777777777",
            "streaming": "duplex"
          },
          "payload": {
            "task_group": "audio",
            "task": "tts",
            "function": "SpeechSynthesizer",
            "model": "cosyvoice-v3-flash",
            "parameters": {
              "text_type": "PlainText",
              "voice": "longxiaochun",
              "format": "pcm",
              "sample_rate": 24000
            },
            "input": {}
          }
        },
        "type": "run-task"
      },
      {
        "direction": "server",
        "frameKind": "json",
        "eventType": "task-started",
        "wire": {
          "header": {
            "event": "task-started",
            "task_id": "77777777-7777-4777-8777-777777777777",
            "attributes": {}
          },
          "payload": {}
        },
        "type": "task-started"
      },
      {
        "direction": "client",
        "frameKind": "json",
        "eventType": "continue-task",
        "wire": {
          "header": {
            "action": "continue-task",
            "task_id": "77777777-7777-4777-8777-777777777777",
            "streaming": "duplex"
          },
          "payload": {
            "input": {
              "text": "hello"
            }
          }
        },
        "type": "continue-task"
      },
      {
        "direction": "server",
        "frameKind": "json",
        "eventType": "result-generated",
        "wire": {
          "header": {
            "event": "result-generated",
            "task_id": "77777777-7777-4777-8777-777777777777",
            "attributes": {}
          },
          "payload": {
            "output": {}
          }
        },
        "type": "result-generated"
      },
      {
        "direction": "server",
        "frameKind": "binary",
        "eventType": "binary.audio",
        "activeTaskId": "77777777-7777-4777-8777-777777777777",
        "type": "binary.audio",
        "frameType": "binary",
        "payloadOmitted": true
      },
      {
        "direction": "client",
        "frameKind": "json",
        "eventType": "finish-task",
        "wire": {
          "header": {
            "action": "finish-task",
            "task_id": "77777777-7777-4777-8777-777777777777",
            "streaming": "duplex"
          },
          "payload": {
            "input": {}
          }
        },
        "type": "finish-task"
      },
      {
        "direction": "server",
        "frameKind": "json",
        "eventType": "task-finished",
        "wire": {
          "header": {
            "event": "task-finished",
            "task_id": "77777777-7777-4777-8777-777777777777",
            "attributes": {}
          },
          "payload": {
            "output": {},
            "usage": null
          }
        },
        "type": "task-finished"
      },
      {
        "direction": "client",
        "frameKind": "json",
        "eventType": "run-task",
        "wire": {
          "header": {
            "action": "run-task",
            "task_id": "88888888-8888-4888-8888-888888888888",
            "streaming": "duplex"
          },
          "payload": {
            "task_group": "audio",
            "task": "tts",
            "function": "SpeechSynthesizer",
            "model": "cosyvoice-v3-flash",
            "parameters": {
              "text_type": "PlainText",
              "voice": "longxiaochun",
              "format": "pcm",
              "sample_rate": 24000
            },
            "input": {}
          }
        },
        "type": "run-task"
      },
      {
        "direction": "server",
        "frameKind": "json",
        "eventType": "task-started",
        "wire": {
          "header": {
            "event": "task-started",
            "task_id": "88888888-8888-4888-8888-888888888888",
            "attributes": {}
          },
          "payload": {}
        },
        "type": "task-started"
      },
      {
        "direction": "client",
        "frameKind": "json",
        "eventType": "continue-task",
        "wire": {
          "header": {
            "action": "continue-task",
            "task_id": "88888888-8888-4888-8888-888888888888",
            "streaming": "duplex"
          },
          "payload": {
            "input": {
              "text": "second task"
            }
          }
        },
        "type": "continue-task"
      },
      {
        "direction": "server",
        "frameKind": "json",
        "eventType": "result-generated",
        "wire": {
          "header": {
            "event": "result-generated",
            "task_id": "88888888-8888-4888-8888-888888888888",
            "attributes": {}
          },
          "payload": {
            "output": {}
          }
        },
        "type": "result-generated"
      },
      {
        "direction": "server",
        "frameKind": "binary",
        "eventType": "binary.audio",
        "activeTaskId": "88888888-8888-4888-8888-888888888888",
        "type": "binary.audio",
        "frameType": "binary",
        "payloadOmitted": true
      },
      {
        "direction": "client",
        "frameKind": "json",
        "eventType": "finish-task",
        "wire": {
          "header": {
            "action": "finish-task",
            "task_id": "88888888-8888-4888-8888-888888888888",
            "streaming": "duplex"
          },
          "payload": {
            "input": {}
          }
        },
        "type": "finish-task"
      },
      {
        "direction": "server",
        "frameKind": "json",
        "eventType": "task-finished",
        "wire": {
          "header": {
            "event": "task-finished",
            "task_id": "88888888-8888-4888-8888-888888888888",
            "attributes": {}
          },
          "payload": {
            "output": {},
            "usage": null
          }
        },
        "type": "task-finished",
        "terminal": true
      }
    ],
    "audio": "<redacted>"
  }
}
